"","summary","date","country"
"263","Philip Weiss article about fanatical 'Clinton crazies' who spend their lives hating the President; crazies include Arkansans like Larry Nichols and Gary Parks, who have developed monstrous view of Clinton as Satan's nephew and see themselves as martyrs; others are conservative and/or conspiratorial reporters like Ambrose Evans-Pritchard of London Sunday Telegraph, who portray Clinton as figurehead for corrupt political organization; others are freelance obsessives, for whom Internet was invented, who see high moral drama in Clinton scandals; prominent here are Hugh H Sprunt and Chris Ruddy, who devote themselves to conspiracy theorists' favorite case, suicide of White House counsel Vincent Foster; influential haters number perhaps 100, but their suspicions percolate to far larger audience; Pat Matrisciana, producer of Christian-right videos, has about 300,000 copies of his Clinton Chronicles video in circulation; photos; diagram on theories about Foster death; fixations seem to reveal less about Clinton than about strain of paranoia abroad in land, and deep distrust of Government and newspapers; Little Rock columnist Gene Lyons notes that, no matter what one thinks about Whitewater case, Clinton does not merit such hatred, except as symbol of what some people fear (L)",1997,FALSE
"264","Algerians, battered by five years of civil war, apparently have approved authoritarian new Constitution that would put end to country's troubled attempt to create open democratic political system; new Constitution would ban Islamic political parties, emasculate Parliament and grant sweeping new powers to Pres Liamine Zeroual; it clearly reflects outlook of entrenched military-backed oligarchy that has ruled Alergia since independence from France in 1962; photo (M)",1996,FALSE
"265","US military's problems in trying to deal with sexual issues discussed in light of recent cases of rape and sexual harassment at Army training centers; photo (S)",1996,FALSE
"266","Speakers on second night of Democratic National Convention in Chicago will include Rev Jesse Jackson, Sens Joseph Biden and John Kerry and Reprs John Lewis and Lynn Rivers; photos (M)",1996,FALSE
"270","Asian investment is increasing in Los Angeles, Calif, mainly from Taiwan, Hong Kong and Indonesia, driven partly by bargain real estate prices in Los Angeles and political uncertainty at home; in last three years, Asian-based companies have bought at least 15 buildings--office towers and hotels--in Los Angeles area, each priced at more than $10 million; photos (L)",1996,FALSE
"271","Saddam Hussein's assault on Kurdish zone in northern Iraq has undermined covert operation by Central Intelligence Agency aimed at overthrowing Iraqi leader, senior Clinton Administration officials say; handful of CIA officers recently fled country as Iraqi forces occupied Erbil; Pres Clinton expanded covert operation in Jan, signing secret order directing CIA to provide weapons, organize some military training and install some intelligence-gathering equipment for fractious groups seeking to unseat Hussein (M)",1996,FALSE
"279","Number of fish raised on farms has doubled in last decade; Federal and industry experts say that salmon is farm-raised in nearly every country with access to cold, deep water, and half shrimp eaten in country comes from farms; treasured bay scallops, found wild in a limited area between Long Island and Cape Cod, are exported by the ton from farms in China; photo (M)",1996,FALSE
"776","Article on moves by Nassau and Suffolk County police departments to increase use of mounted policemen as budgetary constraints make it necessary to cut number of patrol cars; illus (M)",1980,FALSE
"799","NYC Police Dept announces that it plans to spend $2.8 million in overtime to put 400 more officers on streets during high crime months of July and August; Deputy Comr William J Devine comments (M)",1980,FALSE
"800","Ravitch weighs fare increase to pay for increased police security in NYC subways (S)",1980,FALSE
"803","Darien school officials attempt to reassure students at Mather Junior High School as police cruisers patrol neighborhood and officers search woods surrounding school looking for clues in strangulation murder of 13-year-old student James Hafner, illustration of students and principal Gerard Coulombe (S)",1980,FALSE
"811","police and paramilitary units fire on demonstrators, wounding at least 1 protester (S)",1980,FALSE
"823","Stamford, Connecticut, policemen's union pickets to protest statements made by Police Chief Victor I Cizanckas, who was allegedly misquoted in March issue of Law Enforcement News as saying Stamford police were '9% honest cops'; police union president Salvatore Ladestro maintains article had demoralizing effect on force (M)",1980,FALSE
"827","Article on views of George Bush of residents of Kennebunkport, (M), where Bush spends summers (L)",1980,FALSE
"834","Citizens for Clean Air spokesman Stan Pinkwas article urges NYC to reduce traffic congestion in Manhattan's business district; drawing (M)",1980,FALSE
"835","LIRR police officers begin riding trains regularly in effort to stem increasing number of violent incidents against passengers and train crews, first time in LIRR's history such measures have been taken; railroad police chief Joseph Flynn notes 21 arrests have been made in '80, one for robbery and remainder for assault and disorderly conduct; 733 incidents occurred in '79 compared with 548 in '78; illus (M)",1980,FALSE
"836","Analysis: Polish Communist Party is caught in difficult squeeze between demands of workers' movement at home and dictums of Soviet Union (M)",1980,FALSE
"837","article on growing number of Long Island, NY, homes installing alarms to combat rising burglary incidence; photo (M)",1980,FALSE
"839","Miami authorities ask parents to keep children at home on Halloween night in light of Halloween violence in 1979 (M)",1980,FALSE
"843","Article by WBBM-TV, Chicago, Ill, anchorman-reporter Bill Kurtis on increase in illegal heroin smuggling into US; illus (L)",1980,FALSE
"847","Greg Mitchell article on Justice Department's Witness Protection Program, instituted in 1970, to provide security for individuals who offer evidence against members of organized crime; recounts plight of couple who provided evidence against company that was beginning to make connections with organized crime and who have not been treated properly (L)",1980,FALSE
"848","FBI uniform crime report shows 23.1% increase in crime in Long Beach, NY, during first 3 months of '80 (S)",1980,FALSE
"853","Fox, Michael W: The Soul of the Wolf reviewed by John W Miller",1980,FALSE
"855","actress Sophie Schwab, who appears in Barnum, marries talent agent David Rosen (S)",1980,FALSE
"856","House Subcommittee on Environment, Energy and Natural Resources is investigating how eastern Long Island's groundwater supply became contaminated with traces of Temik, Union Carbide pesticide that was in use on Island for 4 years as means of controlling Colorado potato beetle (S)",1980,FALSE
"860","John Darnton article on political, economic, social and international ramifications of 60-day labor revolt in Poland; illustrations (L)",1980,FALSE
"861","Analysis of NAACP finds organization is struggling to modernize itself in effort to regain its position as leader of civil rights movement (M)",1980,FALSE
"862","Safire comments on words 'gridlock' and 'giveback;' cartoon (L)",1980,FALSE
"865","Connecticut Transportation Comr Arthur B Powers reports that average car in state burned only 651 gallons of fuel last year, down 5.1% from '78 figure; state's total gasoline consumption, however, was down only 3%, since there were more cars on road (S)",1980,FALSE
"867","Tad Szulc article examines roots of radical political uprisings in Caribbean that are threatening region with turmoil and revolution; holds Carter Administration views present trend as part of a broad Soviet offensive to win influence over newly independent islands; focuses on Cuban-equipped and trained People's Revolutionary Army in Grenada; map; illustrations (L)",1980,FALSE
"870","NJ Atty Gen John J Degnan says organized crime has grown stronger in Atlantic City since start of casino gambling, legislative hearing on Gov Byrne's proposals to revamp commission in wake of MacDonald's resignation; Degnan por (M)",1980,FALSE
"871","article on Dem aspirants; discusses their campaign styles and issues that they are emphasizing (M)",1980,FALSE
"874","Comment on changes in Cleveland (Ohio) in last 6 months; notes fiery and often controversial leadership of former Mayor Dennis J Kucinich has been replaced by placid presence of Mayor George V Voinovich; notes change has cleared air of constant political infighting that marked much of Kucinich's administration; Voinovich's financial recovery plan discussed (L)",1980,FALSE
"878","Sen Edward Kennedy's stand on energy issues summarized (S)",1980,FALSE
"881","Winters interviewed; portrait (S)",1980,FALSE
"883","John B Anderson is only one of 7 Republican Presidential aspirants in Manchester, NH, debate, who does not favor increased military strength (M)",1980,FALSE
